"categoryPath","title","author","heShortDesc","heDesc","heDescNew"
"משנה>אחרונים>לחם שמים>סדר מועד","לחם שמים על משנה סוכה","יעקב עמדין","פירוש למשנה ולהלכות בית הבחירה להרמב״ם שנכתב על ידי רבי יעקב עמדין (יַעְבֵ""ץ) במאה ה-18 בגרמניה","״לחם שמים״ הוא פירוש מהמאה ה-18 לששה סדרי משנה ולהלכות בית הבחירה להרמב״ם מאת רבי יעקב ישראל בן צבי אשכנזי עֶמְדין (המכונה בראשי התיבות שלו יַעְבֵ""ץ). חיבור זה הוא הראשון מבין חיבורים רבים של היַעְבֵ""ץ, שיצא לאור לפני שהקים בית דפוס משלו בהמבורג שבגרמניה. הוא מציג את העבודה בהתנצלות על כך שהוא מתיימר לתרום לאוצר הספרים היהודי בעוד הוא צעיר, ובמיוחד על התנצחותו עם פירוש תוספות יום טוב הנחשב.",""
"משנה>אחרונים>לחם שמים","לחם שמים, הקדמה לפירוש המשנה","יעקב עמדין","פירוש למשנה ולהלכות בית הבחירה להרמב״ם שנכתב על ידי רבי יעקב עמדין (יַעְבֵ""ץ) במאה ה-18 בגרמניה","״לחם שמים״ הוא פירוש מהמאה ה-18 לששה סדרי משנה ולהלכות בית הבחירה להרמב״ם מאת רבי יעקב ישראל בן צבי אשכנזי עֶמְדין (המכונה בראשי התיבות שלו יַעְבֵ""ץ). חיבור זה הוא הראשון מבין חיבורים רבים של היַעְבֵ""ץ, שיצא לאור לפני שהקים בית דפוס משלו בהמבורג שבגרמניה. הוא מציג את העבודה בהתנצלות על כך שהוא מתיימר לתרום לאוצר הספרים היהודי בעוד הוא צעיר, ובמיוחד על התנצחותו עם פירוש תוספות יום טוב הנחשב.",""
"משנה>אחרונים>לחם שמים>סדר זרעים","לחם שמים על משנה כלאים","יעקב עמדין","פירוש למשנה ולהלכות בית הבחירה להרמב״ם שנכתב על ידי רבי יעקב עמדין (יַעְבֵ""ץ) במאה ה-18 בגרמניה","״לחם שמים״ הוא פירוש מהמאה ה-18 לששה סדרי משנה ולהלכות בית הבחירה להרמב״ם מאת רבי יעקב ישראל בן צבי אשכנזי עֶמְדין (המכונה בראשי התיבות שלו יַעְבֵ""ץ). חיבור זה הוא הראשון מבין חיבורים רבים של היַעְבֵ""ץ, שיצא לאור לפני שהקים בית דפוס משלו בהמבורג שבגרמניה. הוא מציג את העבודה בהתנצלות על כך שהוא מתיימר לתרום לאוצר הספרים היהודי בעוד הוא צעיר, ובמיוחד על התנצחותו עם פירוש תוספות יום טוב הנחשב.",""
"משנה>אחרונים>לחם שמים>סדר זרעים","לחם שמים על משנה שביעית","יעקב עמדין","פירוש למשנה ולהלכות בית הבחירה להרמב״ם שנכתב על ידי רבי יעקב עמדין (יַעְבֵ""ץ) במאה ה-18 בגרמניה","״לחם שמים״ הוא פירוש מהמאה ה-18 לששה סדרי משנה ולהלכות בית הבחירה להרמב״ם מאת רבי יעקב ישראל בן צבי אשכנזי עֶמְדין (המכונה בראשי התיבות שלו יַעְבֵ""ץ). חיבור זה הוא הראשון מבין חיבורים רבים של היַעְבֵ""ץ, שיצא לאור לפני שהקים בית דפוס משלו בהמבורג שבגרמניה. הוא מציג את העבודה בהתנצלות על כך שהוא מתיימר לתרום לאוצר הספרים היהודי בעוד הוא צעיר, ובמיוחד על התנצחותו עם פירוש תוספות יום טוב הנחשב.",""
"משנה>אחרונים>לחם שמים>סדר זרעים","לחם שמים על משנה מעשר שני","יעקב עמדין","פירוש למשנה ולהלכות בית הבחירה להרמב״ם שנכתב על ידי רבי יעקב עמדין (יַעְבֵ""ץ) במאה ה-18 בגרמניה","״לחם שמים״ הוא פירוש מהמאה ה-18 לששה סדרי משנה ולהלכות בית הבחירה להרמב״ם מאת רבי יעקב ישראל בן צבי אשכנזי עֶמְדין (המכונה בראשי התיבות שלו יַעְבֵ""ץ). חיבור זה הוא הראשון מבין חיבורים רבים של היַעְבֵ""ץ, שיצא לאור לפני שהקים בית דפוס משלו בהמבורג שבגרמניה. הוא מציג את העבודה בהתנצלות על כך שהוא מתיימר לתרום לאוצר הספרים היהודי בעוד הוא צעיר, ובמיוחד על התנצחותו עם פירוש תוספות יום טוב הנחשב.",""
"משנה>אחרונים>לחם שמים>סדר זרעים","לחם שמים על משנה ביכורים","יעקב עמדין","פירוש למשנה ולהלכות בית הבחירה להרמב״ם שנכתב על ידי רבי יעקב עמדין (יַעְבֵ""ץ) במאה ה-18 בגרמניה","״לחם שמים״ הוא פירוש מהמאה ה-18 לששה סדרי משנה ולהלכות בית הבחירה להרמב״ם מאת רבי יעקב ישראל בן צבי אשכנזי עֶמְדין (המכונה בראשי התיבות שלו יַעְבֵ""ץ). חיבור זה הוא הראשון מבין חיבורים רבים של היַעְבֵ""ץ, שיצא לאור לפני שהקים בית דפוס משלו בהמבורג שבגרמניה. הוא מציג את העבודה בהתנצלות על כך שהוא מתיימר לתרום לאוצר הספרים היהודי בעוד הוא צעיר, ובמיוחד על התנצחותו עם פירוש תוספות יום טוב הנחשב.",""
"משנה>אחרונים>לחם שמים>סדר זרעים","לחם שמים על משנה חלה","יעקב עמדין","פירוש למשנה ולהלכות בית הבחירה להרמב״ם שנכתב על ידי רבי יעקב עמדין (יַעְבֵ""ץ) במאה ה-18 בגרמניה","״לחם שמים״ הוא פירוש מהמאה ה-18 לששה סדרי משנה ולהלכות בית הבחירה להרמב״ם מאת רבי יעקב ישראל בן צבי אשכנזי עֶמְדין (המכונה בראשי התיבות שלו יַעְבֵ""ץ). חיבור זה הוא הראשון מבין חיבורים רבים של היַעְבֵ""ץ, שיצא לאור לפני שהקים בית דפוס משלו בהמבורג שבגרמניה. הוא מציג את העבודה בהתנצלות על כך שהוא מתיימר לתרום לאוצר הספרים היהודי בעוד הוא צעיר, ובמיוחד על התנצחותו עם פירוש תוספות יום טוב הנחשב.",""
"משנה>אחרונים>לחם שמים>סדר זרעים","לחם שמים על משנה מעשרות","יעקב עמדין","פירוש למשנה ולהלכות בית הבחירה להרמב״ם שנכתב על ידי רבי יעקב עמדין (יַעְבֵ""ץ) במאה ה-18 בגרמניה","״לחם שמים״ הוא פירוש מהמאה ה-18 לששה סדרי משנה ולהלכות בית הבחירה להרמב״ם מאת רבי יעקב ישראל בן צבי אשכנזי עֶמְדין (המכונה בראשי התיבות שלו יַעְבֵ""ץ). חיבור זה הוא הראשון מבין חיבורים רבים של היַעְבֵ""ץ, שיצא לאור לפני שהקים בית דפוס משלו בהמבורג שבגרמניה. הוא מציג את העבודה בהתנצלות על כך שהוא מתיימר לתרום לאוצר הספרים היהודי בעוד הוא צעיר, ובמיוחד על התנצחותו עם פירוש תוספות יום טוב הנחשב.",""
"משנה>אחרונים>לחם שמים>סדר זרעים","לחם שמים על משנה דמאי","יעקב עמדין","פירוש למשנה ולהלכות בית הבחירה להרמב״ם שנכתב על ידי רבי יעקב עמדין (יַעְבֵ""ץ) במאה ה-18 בגרמניה","״לחם שמים״ הוא פירוש מהמאה ה-18 לששה סדרי משנה ולהלכות בית הבחירה להרמב״ם מאת רבי יעקב ישראל בן צבי אשכנזי עֶמְדין (המכונה בראשי התיבות שלו יַעְבֵ""ץ). חיבור זה הוא הראשון מבין חיבורים רבים של היַעְבֵ""ץ, שיצא לאור לפני שהקים בית דפוס משלו בהמבורג שבגרמניה. הוא מציג את העבודה בהתנצלות על כך שהוא מתיימר לתרום לאוצר הספרים היהודי בעוד הוא צעיר, ובמיוחד על התנצחותו עם פירוש תוספות יום טוב הנחשב.",""
"משנה>אחרונים>לחם שמים>סדר זרעים","לחם שמים על משנה פאה","יעקב עמדין","פירוש למשנה ולהלכות בית הבחירה להרמב״ם שנכתב על ידי רבי יעקב עמדין (יַעְבֵ""ץ) במאה ה-18 בגרמניה","״לחם שמים״ הוא פירוש מהמאה ה-18 לששה סדרי משנה ולהלכות בית הבחירה להרמב״ם מאת רבי יעקב ישראל בן צבי אשכנזי עֶמְדין (המכונה בראשי התיבות שלו יַעְבֵ""ץ). חיבור זה הוא הראשון מבין חיבורים רבים של היַעְבֵ""ץ, שיצא לאור לפני שהקים בית דפוס משלו בהמבורג שבגרמניה. הוא מציג את העבודה בהתנצלות על כך שהוא מתיימר לתרום לאוצר הספרים היהודי בעוד הוא צעיר, ובמיוחד על התנצחותו עם פירוש תוספות יום טוב הנחשב.",""
"משנה>אחרונים>לחם שמים>סדר זרעים","לחם שמים על משנה ערלה","יעקב עמדין","פירוש למשנה ולהלכות בית הבחירה להרמב״ם שנכתב על ידי רבי יעקב עמדין (יַעְבֵ""ץ) במאה ה-18 בגרמניה","״לחם שמים״ הוא פירוש מהמאה ה-18 לששה סדרי משנה ולהלכות בית הבחירה להרמב״ם מאת רבי יעקב ישראל בן צבי אשכנזי עֶמְדין (המכונה בראשי התיבות שלו יַעְבֵ""ץ). חיבור זה הוא הראשון מבין חיבורים רבים של היַעְבֵ""ץ, שיצא לאור לפני שהקים בית דפוס משלו בהמבורג שבגרמניה. הוא מציג את העבודה בהתנצלות על כך שהוא מתיימר לתרום לאוצר הספרים היהודי בעוד הוא צעיר, ובמיוחד על התנצחותו עם פירוש תוספות יום טוב הנחשב.",""
"משנה>אחרונים>לחם שמים>סדר זרעים","לחם שמים על משנה ברכות","יעקב עמדין","פירוש למשנה ולהלכות בית הבחירה להרמב״ם שנכתב על ידי רבי יעקב עמדין (יַעְבֵ""ץ) במאה ה-18 בגרמניה","״לחם שמים״ הוא פירוש מהמאה ה-18 לששה סדרי משנה ולהלכות בית הבחירה להרמב״ם מאת רבי יעקב ישראל בן צבי אשכנזי עֶמְדין (המכונה בראשי התיבות שלו יַעְבֵ""ץ). חיבור זה הוא הראשון מבין חיבורים רבים של היַעְבֵ""ץ, שיצא לאור לפני שהקים בית דפוס משלו בהמבורג שבגרמניה. הוא מציג את העבודה בהתנצלות על כך שהוא מתיימר לתרום לאוצר הספרים היהודי בעוד הוא צעיר, ובמיוחד על התנצחותו עם פירוש תוספות יום טוב הנחשב.",""
"משנה>אחרונים>לחם שמים>סדר זרעים","לחם שמים על משנה תרומות","יעקב עמדין","פירוש למשנה ולהלכות בית הבחירה להרמב״ם שנכתב על ידי רבי יעקב עמדין (יַעְבֵ""ץ) במאה ה-18 בגרמניה","״לחם שמים״ הוא פירוש מהמאה ה-18 לששה סדרי משנה ולהלכות בית הבחירה להרמב״ם מאת רבי יעקב ישראל בן צבי אשכנזי עֶמְדין (המכונה בראשי התיבות שלו יַעְבֵ""ץ). חיבור זה הוא הראשון מבין חיבורים רבים של היַעְבֵ""ץ, שיצא לאור לפני שהקים בית דפוס משלו בהמבורג שבגרמניה. הוא מציג את העבודה בהתנצלות על כך שהוא מתיימר לתרום לאוצר הספרים היהודי בעוד הוא צעיר, ובמיוחד על התנצחותו עם פירוש תוספות יום טוב הנחשב.",""
"משנה>אחרונים>לחם שמים>סדר נשים","לחם שמים על משנה נזיר","יעקב עמדין","פירוש למשנה ולהלכות בית הבחירה להרמב״ם שנכתב על ידי רבי יעקב עמדין (יַעְבֵ""ץ) במאה ה-18 בגרמניה","״לחם שמים״ הוא פירוש מהמאה ה-18 לששה סדרי משנה ולהלכות בית הבחירה להרמב״ם מאת רבי יעקב ישראל בן צבי אשכנזי עֶמְדין (המכונה בראשי התיבות שלו יַעְבֵ""ץ). חיבור זה הוא הראשון מבין חיבורים רבים של היַעְבֵ""ץ, שיצא לאור לפני שהקים בית דפוס משלו בהמבורג שבגרמניה. הוא מציג את העבודה בהתנצלות על כך שהוא מתיימר לתרום לאוצר הספרים היהודי בעוד הוא צעיר, ובמיוחד על התנצחותו עם פירוש תוספות יום טוב הנחשב.",""
"משנה>אחרונים>לחם שמים>סדר נשים","לחם שמים על משנה יבמות","יעקב עמדין","פירוש למשנה ולהלכות בית הבחירה להרמב״ם שנכתב על ידי רבי יעקב עמדין (יַעְבֵ""ץ) במאה ה-18 בגרמניה","״לחם שמים״ הוא פירוש מהמאה ה-18 לששה סדרי משנה ולהלכות בית הבחירה להרמב״ם מאת רבי יעקב ישראל בן צבי אשכנזי עֶמְדין (המכונה בראשי התיבות שלו יַעְבֵ""ץ). חיבור זה הוא הראשון מבין חיבורים רבים של היַעְבֵ""ץ, שיצא לאור לפני שהקים בית דפוס משלו בהמבורג שבגרמניה. הוא מציג את העבודה בהתנצלות על כך שהוא מתיימר לתרום לאוצר הספרים היהודי בעוד הוא צעיר, ובמיוחד על התנצחותו עם פירוש תוספות יום טוב הנחשב.",""
"משנה>אחרונים>לחם שמים>סדר נשים","לחם שמים על משנה כתובות","יעקב עמדין","פירוש למשנה ולהלכות בית הבחירה להרמב״ם שנכתב על ידי רבי יעקב עמדין (יַעְבֵ""ץ) במאה ה-18 בגרמניה","״לחם שמים״ הוא פירוש מהמאה ה-18 לששה סדרי משנה ולהלכות בית הבחירה להרמב״ם מאת רבי יעקב ישראל בן צבי אשכנזי עֶמְדין (המכונה בראשי התיבות שלו יַעְבֵ""ץ). חיבור זה הוא הראשון מבין חיבורים רבים של היַעְבֵ""ץ, שיצא לאור לפני שהקים בית דפוס משלו בהמבורג שבגרמניה. הוא מציג את העבודה בהתנצלות על כך שהוא מתיימר לתרום לאוצר הספרים היהודי בעוד הוא צעיר, ובמיוחד על התנצחותו עם פירוש תוספות יום טוב הנחשב.",""
"משנה>אחרונים>לחם שמים>סדר נשים","לחם שמים על משנה סוטה","יעקב עמדין","פירוש למשנה ולהלכות בית הבחירה להרמב״ם שנכתב על ידי רבי יעקב עמדין (יַעְבֵ""ץ) במאה ה-18 בגרמניה","״לחם שמים״ הוא פירוש מהמאה ה-18 לששה סדרי משנה ולהלכות בית הבחירה להרמב״ם מאת רבי יעקב ישראל בן צבי אשכנזי עֶמְדין (המכונה בראשי התיבות שלו יַעְבֵ""ץ). חיבור זה הוא הראשון מבין חיבורים רבים של היַעְבֵ""ץ, שיצא לאור לפני שהקים בית דפוס משלו בהמבורג שבגרמניה. הוא מציג את העבודה בהתנצלות על כך שהוא מתיימר לתרום לאוצר הספרים היהודי בעוד הוא צעיר, ובמיוחד על התנצחותו עם פירוש תוספות יום טוב הנחשב.",""
"משנה>אחרונים>לחם שמים>סדר נשים","לחם שמים על משנה קידושין","יעקב עמדין","פירוש למשנה ולהלכות בית הבחירה להרמב״ם שנכתב על ידי רבי יעקב עמדין (יַעְבֵ""ץ) במאה ה-18 בגרמניה","״לחם שמים״ הוא פירוש מהמאה ה-18 לששה סדרי משנה ולהלכות בית הבחירה להרמב״ם מאת רבי יעקב ישראל בן צבי אשכנזי עֶמְדין (המכונה בראשי התיבות שלו יַעְבֵ""ץ). חיבור זה הוא הראשון מבין חיבורים רבים של היַעְבֵ""ץ, שיצא לאור לפני שהקים בית דפוס משלו בהמבורג שבגרמניה. הוא מציג את העבודה בהתנצלות על כך שהוא מתיימר לתרום לאוצר הספרים היהודי בעוד הוא צעיר, ובמיוחד על התנצחותו עם פירוש תוספות יום טוב הנחשב.",""
"משנה>אחרונים>לחם שמים>סדר נשים","לחם שמים על משנה נדרים","יעקב עמדין","פירוש למשנה ולהלכות בית הבחירה להרמב״ם שנכתב על ידי רבי יעקב עמדין (יַעְבֵ""ץ) במאה ה-18 בגרמניה","״לחם שמים״ הוא פירוש מהמאה ה-18 לששה סדרי משנה ולהלכות בית הבחירה להרמב״ם מאת רבי יעקב ישראל בן צבי אשכנזי עֶמְדין (המכונה בראשי התיבות שלו יַעְבֵ""ץ). חיבור זה הוא הראשון מבין חיבורים רבים של היַעְבֵ""ץ, שיצא לאור לפני שהקים בית דפוס משלו בהמבורג שבגרמניה. הוא מציג את העבודה בהתנצלות על כך שהוא מתיימר לתרום לאוצר הספרים היהודי בעוד הוא צעיר, ובמיוחד על התנצחותו עם פירוש תוספות יום טוב הנחשב.",""
"משנה>אחרונים>לחם שמים>סדר נשים","לחם שמים על משנה גיטין","יעקב עמדין","פירוש למשנה ולהלכות בית הבחירה להרמב״ם שנכתב על ידי רבי יעקב עמדין (יַעְבֵ""ץ) במאה ה-18 בגרמניה","״לחם שמים״ הוא פירוש מהמאה ה-18 לששה סדרי משנה ולהלכות בית הבחירה להרמב״ם מאת רבי יעקב ישראל בן צבי אשכנזי עֶמְדין (המכונה בראשי התיבות שלו יַעְבֵ""ץ). חיבור זה הוא הראשון מבין חיבורים רבים של היַעְבֵ""ץ, שיצא לאור לפני שהקים בית דפוס משלו בהמבורג שבגרמניה. הוא מציג את העבודה בהתנצלות על כך שהוא מתיימר לתרום לאוצר הספרים היהודי בעוד הוא צעיר, ובמיוחד על התנצחותו עם פירוש תוספות יום טוב הנחשב.",""
"משנה>סדר נשים","משנה סוטה","","אישה החשודה בבגידה בבעלה, טקס בירור מעמדה וטקסים אחרים הכרוכים באמירה.","","מאוקסס (XXX) בנטפרי"
"משנה>סדר נשים","משנה כתובות","","שטר הכתובה, חובות הבעל לאשתו וחובות האישה לבעלה.","",""
"משנה>סדר נשים","משנה נדרים","","נדרים שאדם נודר מרצונו, לרוב נדרים האוסרים על הנודר מעשים או חפצים מסוימים.","",""
"משנה>סדר נשים","משנה נזיר","","הנזיר: אדם שנודר להימנע מיין, מתספורת ומהיטמאות למת לפרק זמן מוגדר.","",""
"משנה>סדר נשים","משנה יבמות","","ייבום, חליצה ואיסורי עריות.","",""
"משנה>סדר נשים","משנה קידושין","","קידושין, נישואין, דיני קניין וענייני יוחסין.","",""
"משנה>סדר נשים","משנה גיטין","","דיני גירושין, בדגש על כתיבת שטר הגט ונתינתו.","",""
"משנה>ראשונים","ראבד על משנה דמאי","ראב""ד","ברי פירוש מהמאה ה-12 על מסכת דמאי, מאת רבי אברהם בן דוד מפּוֹשְקְיֶרָה","ראב""ד (אברהם בן דוד מפּוֹשְקְיֶרָה, המאה ה-12) כתב פירושים רבים על ששה סדרי משנה והתלמוד הבבלי. פירושים אלה כוללים הסברים על דרך הפשט,  כמו גם ניתוחים הלכתיים מורכבים יותר. הם זכו לכבוד רב על ידי תלמידי חכמים אחרים בדורו, אך מעטים שרדו עד ימינו. מתוך פירושו של הראב""ד על מסכת דמאי, הדנה בדיני תבואה ופירות שספק אם הפרישו מהם תרומות ומעשרות, נותרו בידינו רק חלקים בודדים. ",""
"משנה>ראשונים","ראבד על משנה קינים","ראב""ד","פירוש מהמאה ה-12 למסכת קינים, מאת רבי אברהם בן דוד מפּוֹשְקְיֶרָה","ראב""ד (אברהם בן דוד מפּוֹשְקְיֶרָה, המאה ה-12) כתב פירושים רבים על ששה סדרי משנה והתלמוד הבבלי. פירושים אלה כוללים הסברים על דרך הפשט,  כמו גם ניתוחים הלכתיים מורכבים יותר. הם זכו לכבוד רב על ידי תלמידי חכמים אחרים בדורו, אך מעטים שרדו עד ימינו.  פירושו של הראב""ד לקינים, מסכת בסוף סדר קדשים הדנה בדיני מנחות ציפורים מעורבות, היא אחד הכרכים הבודדים הקיימים של פירושים אלה ומתחילה בשיר קצר המבקש את עזרת ה' בהבנת המסכת. ",""
"מילונים וספרי יעץ>מילונים","הפלאה שבערכין על ספר הערוך","ישעיה פיק ברלין","אוסף תוספות והערות לספר הערוך מהמאה ה-18.","",""
"מילונים וספרי יעץ>מילונים","אוצר לעזי רשי","משה קטן","תרגום לעברית של מילים בצרפתית עתיקה המופיעות בפירוש רש""י למקרא ולתלמוד, נכתב במאה ה-20.","",""
"מילונים וספרי יעץ>מילונים","ספר הערוך","רבי נתן בן יחיאל","המילון המקיף הקדום ביותר לספרות חז""ל. נכתב בתחילת המאה ה-12, ומצוטט לעיתים קרובות בכתבי פרשני התלמוד.","",""
"מילונים וספרי יעץ>אנציקלופדיות>שם הגדולים","קונטרס פליטת ספרים","מנחם מאנדל קרנגל","""קונטרס פליטת סופרים"" הוא תוספת מהמאה ה-19 לספר ""שם הגדולים"" של החיד""א. נכתב על ידי רבי מנחם מנדל קרנגל בקרקוב, פולין.","״קונטרס פליטת ספרים״ הוא תוספת מהמאה ה-19 לספר ""שם הגדולים"" של רבי חיים יוסף דוד אזולאי (החיד״א) מאת רבי מנחם מנדל קרנגל, שפרסם נוסח מתוקן של שם הגדולים בקרקוב, פולין. ""קונטרס פליטת סופרים"" מורכב מביבליוגרפיה של יצירות נוספות שאינן מוזכרות ב""שם הגדולים"", כולל יצירות של החיד״א עצמו, יצירות של סופרים מקרקוב ויצירות המוזכרות בכרך הראשון של שם הגדולים (מערכת סופרים). לדוגמה: אגרת הקודש לרמב""ן, דרשות רבי יוסף קארו (מחבר השולחן ערוך), חידושי הר""י מיגאש ועוד.",""
