"categoryPath","title","author","heShortDesc","heDesc","heDescNew"
"בית שני>ספרים חיצונים","מגילת אנטיוכוס","","ניצחונות המקבים על היוונים הסורים כפי שתוארו לאחר מאות שנים.","""מגילת אנטיוכוס"", הידועה גם כ""מגילת החשמונאים"", ""מגילת חנוכה"" או ""מגילה יוונית"", מספרת את סיפור חנוכה ואת ההיסטוריה של ניצחון המקבים (או החשמונאים) על האימפריה הסלאוקית. טקסטים קדומים של החיבור קיימים הן בארמית והן בעברית, אך הגרסה העברית של הטקסט הינה תרגום מילולי של המקור הארמי. תרגום ערבי-יהודי ליצירה נכתב על ידי סעדיה גאון. ישנן מספר תאוריות באשר לזהות מחבר המגילה. ישנם חוקרים אשר תארכו את החיבור לתאריך כלשהו בין המאות הראשונה והחמישית. במהלך ימי הביניים, מגילת אנטיוכוס הוקראה בבתי כנסה בחג החנוכה, כפי שמגילת אסתר נקראת בחג הפורים, והמגילה עדיין מהווה חלק מהליטורגיה של יהודי תימן.","ניצחונות המקבים על היוונים כפי שתוארו לאחר מאות שנים."
"תלמוד ירושלמי>סדר טהרות","תלמוד ירושלמי נדה","","טומאת האישה בנידתה ובמצבים נוספים.","",""
"תלמוד ירושלמי>סדר נזיקין","תלמוד ירושלמי בבא בתרא","","יחסים בין שכנים, בעלות על קרקע, מכירת קרקעות ודיני ירושה.","",""
"תלמוד ירושלמי>סדר נזיקין","תלמוד ירושלמי סנהדרין","","מערכת המשפט, הקמת בית הדין, קבלת עדות וביצוע גזר דין מוות.","",""
"תלמוד ירושלמי>סדר נזיקין","תלמוד ירושלמי מכות","","עדים זוממים וערי מקלט לרוצחים בשגגה.","",""
"תלמוד ירושלמי>סדר נזיקין","תלמוד ירושלמי עבודה זרה","","התרחקות מעבודת אלילים וכללים המסדירים את הקשר בין יהודים ועובדי אלילים.","",""
"תלמוד ירושלמי>סדר נזיקין","תלמוד ירושלמי שבועות","","דיני הנכנס לבית המקדש או אוכל בשר קורבן בהיותו טמא, דיני שבועות.","",""
"תלמוד ירושלמי>סדר נזיקין","תלמוד ירושלמי בבא מציעא","","רכוש שיש עליו מחלוקת, השבת אבדה, דיני שמירה, שכירה ושאילה וחובותיהם של מעסיקים ושל עובדים.","",""
"תלמוד ירושלמי>סדר נזיקין","תלמוד ירושלמי בבא קמא","","אחריות לנזקי אדם או רכוש והפיצויים עליהם.","",""
"תלמוד ירושלמי>סדר נזיקין","תלמוד ירושלמי הוריות","","כפרה על פסיקות שגויות שהורו בבית הדין ועל חטאים בשגגה של כהנים גדולים ומלכים.","",""
"תלמוד ירושלמי>סדר מועד","תלמוד ירושלמי ראש השנה","","ארבעת ראשי השנה, הליך קידוש החודש ודיני תקיעת שופר.","",""
"תלמוד ירושלמי>סדר מועד","תלמוד ירושלמי תענית","","תפילה על הגשם, צום בימי בצורת והצומות שנקבעו לזכר חורבן ירושלים.","",""
"תלמוד ירושלמי>סדר מועד","תלמוד ירושלמי שבת","","מלאכות האסורות בשבת ודינים הקשורים לקדושת היום.","",""
"תלמוד ירושלמי>סדר מועד","תלמוד ירושלמי סוכה","","מבנה הסוכה, החובה לשבת בסוכה, ארבעת המינים ושמחת החג בבית המקדש.","",""
"תלמוד ירושלמי>סדר מועד","תלמוד ירושלמי מועד קטן","","חול המועד (הימים בסוכות ובפסח שאינם ימים טובים), אבלות ונידוי.","",""
"תלמוד ירושלמי>סדר מועד","תלמוד ירושלמי מגילה","","קריאת מגילת אסתר בפורים, קריאת התורה וההפטרות בבית הכנסת ודיני קדושת בית הכנסת ותשמישי קדושה.","",""
"תלמוד ירושלמי>סדר מועד","תלמוד ירושלמי עירובין","","תיחום המרחיב באופן סמלי את התחומים שמותר ללכת ולשאת בהם חפצים בשבת.","",""
"תלמוד ירושלמי>סדר מועד","תלמוד ירושלמי חגיגה","","קורבנות המוקרבים בעת העלייה לרגל לירושלים בשלושת הרגלים (פסח, שבועות וסוכות) ודיני טהרה.","",""
"תלמוד ירושלמי>סדר מועד","תלמוד ירושלמי פסחים","","דינים הקשורים לחג הפסח: איסור חמץ, קורבן הפסח, מצה, מרור וליל הסדר.","",""
"תלמוד ירושלמי>סדר מועד","תלמוד ירושלמי שקלים","","תרומה של מחצית השקל הניתנת לבית המקדש בכל שנה וענייני ניהולו ותפעולו של בית המקדש.","",""
"תלמוד ירושלמי>סדר מועד","תלמוד ירושלמי ביצה","","דיני יום טוב: חפצים האסורים בשימוש, הכנת אוכל בחג לצורך החג והמלאכות האסורות.","",""
"תלמוד ירושלמי>סדר מועד","תלמוד ירושלמי יומא","","יום הכיפורים: הכנות הכהן הגדול, העבודה בבית המקדש, הצום והתשובה.","",""
"תלמוד ירושלמי>סדר זרעים","תלמוד ירושלמי כלאים","","האיסור להכליא זה בזה זרעים, צמחים או בעלי חיים מסוימים ולערב צמר ופשתן בבגד אחד.","",""
"תלמוד ירושלמי>סדר זרעים","תלמוד ירושלמי מעשר שני","","מעשר שבעל התבואה אוכל בטהרה בירושלים או פודה בכסף, ובכסף קונה אוכל - ואוכל אותו בטהרה בירושלים.","",""
"תלמוד ירושלמי>סדר זרעים","תלמוד ירושלמי פאה","","הקצאת חלק מתבואת השדה לעניים ומתנות אחרות מגידולי הקרקע הניתנות לעניים.","",""
"תלמוד ירושלמי>סדר זרעים","תלמוד ירושלמי ברכות","","ברכות ותפילות, בדגש על קריאת שמע ועל תפילת העמידה.","",""
"תלמוד ירושלמי>סדר זרעים","תלמוד ירושלמי ערלה","","האיסור לאכול וליהנות מפירות העץ בשלוש השנים הראשונות לנטיעתו ודיני תערובות של מאכלים אסורים ומותרים לאכילה.","",""
"תלמוד ירושלמי>סדר זרעים","תלמוד ירושלמי דמאי","","החובה להפריש מעשרות מתבואה או פירות שנלקחו מאדם החשוד שלא הפרישם.","",""
"תלמוד ירושלמי>סדר זרעים","תלמוד ירושלמי חלה","","המצווה להפריש חלק מהבצק בעת הכנת לחם ולתת אותו לכהנים.","",""
"תלמוד ירושלמי>סדר זרעים","תלמוד ירושלמי שביעית","","דיני שנת השמיטה, השנה השביעית במחזור החקלאי, שבה אסור לעבוד את האדמה וכן החובות בטלים.","",""
"תלמוד ירושלמי>סדר זרעים","תלמוד ירושלמי מעשרות","","הפרשת מעשרות מגידולי הקרקע לכהנים, ללווים ולעניים וכן לשם אכילתם בטהרה בירושלים.","",""
"תלמוד ירושלמי>סדר זרעים","תלמוד ירושלמי בכורים","","טקס הבאת ביכורי פירות ותבואה משבעת המינים לבית המקדש ונתינתם לכהן ליד המזבח.","",""
"תלמוד ירושלמי>סדר זרעים","תלמוד ירושלמי תרומות","","תרומות שיש להפריש לכהנים מגידולי הקרקע והחובה לשמור על טהרת התרומה.","",""
"תלמוד ירושלמי>סדר נשים","תלמוד ירושלמי כתובות","","שטר הכתובה, חובות הבעל לאשתו וחובות האישה לבעלה.","",""
"תלמוד ירושלמי>סדר נשים","תלמוד ירושלמי יבמות","","ייבום, חליצה ואיסורי עריות.","",""
"תלמוד ירושלמי>סדר נשים","תלמוד ירושלמי סוטה","","אישה החשודה בבגידה בבעלה, טקס בירור מעמדה וטקסים אחרים הכרוכים באמירה.","","מאוקסס (XXX) בנטפרי"
"תלמוד ירושלמי>סדר נשים","תלמוד ירושלמי קידושין","","קידושין, נישואין, דיני קניין וענייני יוחסין.","",""
"תלמוד ירושלמי>סדר נשים","תלמוד ירושלמי גיטין","","דיני גירושין, בדגש על כתיבת שטר הגט ונתינתו.","",""
"תלמוד ירושלמי>סדר נשים","תלמוד ירושלמי נדרים","","נדרים שאדם נודר מרצונו, לרוב נדרים האוסרים על הנודר מעשים או חפצים מסוימים.","",""
"תלמוד ירושלמי>סדר נשים","תלמוד ירושלמי נזיר","","הנזיר: אדם שנודר להימנע מיין, מתספורת ומהיטמאות למת לפרק זמן מוגדר.","",""
"תלמוד ירושלמי>מפרשים>שערי תורת ארץ ישראל>סדר טהרות","שערי תורת ארץ ישראל על תלמוד ירושלמי נדה","זאב וואלף רבינוביץ","פירוש מהמאה ה-20 לתלמוד הירושלמי שנכתב על ידי הרב זאב וולף רבינוביץ","״שערי תורת ארץ ישראל״ הוא פירוש לתלמוד הירושלמי שנכתב בתחילת המאה ה-20 על ידי הרב זאב וולף רבינוביץ. המחבר כותב בהקדמתו כי למד את התלמוד הירושלמי מנעוריו ומצא כי הפירושים הקיימים אינם מספקים, בין השאר משום שמחבריהם הושפעו מגישות של התלמוד הבבלי הנלמד יותר. היצירה יצאה לאור לאחר מותו על ידי בנו של המחבר, יצחק רבינוביץ, שהקדיש אותה לזכר אמו.",""
"תלמוד ירושלמי>מפרשים>שערי תורת ארץ ישראל>סדר נזיקין","שערי תורת ארץ ישראל על תלמוד ירושלמי בבא מציעא","זאב וואלף רבינוביץ","פירוש מהמאה ה-20 לתלמוד הירושלמי שנכתב על ידי הרב זאב וולף רבינוביץ","״שערי תורת ארץ ישראל״ הוא פירוש לתלמוד הירושלמי שנכתב בתחילת המאה ה-20 על ידי הרב זאב וולף רבינוביץ. המחבר כותב בהקדמתו כי למד את התלמוד הירושלמי מנעוריו ומצא כי הפירושים הקיימים אינם מספקים, בין השאר משום שמחבריהם הושפעו מגישות של התלמוד הבבלי הנלמד יותר. היצירה יצאה לאור לאחר מותו על ידי בנו של המחבר, יצחק רבינוביץ, שהקדיש אותה לזכר אמו.",""
"תלמוד ירושלמי>מפרשים>שערי תורת ארץ ישראל>סדר נזיקין","שערי תורת ארץ ישראל על תלמוד ירושלמי הוריות","זאב וואלף רבינוביץ","פירוש מהמאה ה-20 לתלמוד הירושלמי שנכתב על ידי הרב זאב וולף רבינוביץ","״שערי תורת ארץ ישראל״ הוא פירוש לתלמוד הירושלמי שנכתב בתחילת המאה ה-20 על ידי הרב זאב וולף רבינוביץ. המחבר כותב בהקדמתו כי למד את התלמוד הירושלמי מנעוריו ומצא כי הפירושים הקיימים אינם מספקים, בין השאר משום שמחבריהם הושפעו מגישות של התלמוד הבבלי הנלמד יותר. היצירה יצאה לאור לאחר מותו על ידי בנו של המחבר, יצחק רבינוביץ, שהקדיש אותה לזכר אמו.",""
"תלמוד ירושלמי>מפרשים>שערי תורת ארץ ישראל>סדר נזיקין","שערי תורת ארץ ישראל על תלמוד ירושלמי מכות","זאב וואלף רבינוביץ","פירוש מהמאה ה-20 לתלמוד הירושלמי שנכתב על ידי הרב זאב וולף רבינוביץ","״שערי תורת ארץ ישראל״ הוא פירוש לתלמוד הירושלמי שנכתב בתחילת המאה ה-20 על ידי הרב זאב וולף רבינוביץ. המחבר כותב בהקדמתו כי למד את התלמוד הירושלמי מנעוריו ומצא כי הפירושים הקיימים אינם מספקים, בין השאר משום שמחבריהם הושפעו מגישות של התלמוד הבבלי הנלמד יותר. היצירה יצאה לאור לאחר מותו על ידי בנו של המחבר, יצחק רבינוביץ, שהקדיש אותה לזכר אמו.",""
"תלמוד ירושלמי>מפרשים>שערי תורת ארץ ישראל>סדר נזיקין","שערי תורת ארץ ישראל על תלמוד ירושלמי בבא קמא","זאב וואלף רבינוביץ","פירוש מהמאה ה-20 לתלמוד הירושלמי שנכתב על ידי הרב זאב וולף רבינוביץ","״שערי תורת ארץ ישראל״ הוא פירוש לתלמוד הירושלמי שנכתב בתחילת המאה ה-20 על ידי הרב זאב וולף רבינוביץ. המחבר כותב בהקדמתו כי למד את התלמוד הירושלמי מנעוריו ומצא כי הפירושים הקיימים אינם מספקים, בין השאר משום שמחבריהם הושפעו מגישות של התלמוד הבבלי הנלמד יותר. היצירה יצאה לאור לאחר מותו על ידי בנו של המחבר, יצחק רבינוביץ, שהקדיש אותה לזכר אמו.",""
"תלמוד ירושלמי>מפרשים>שערי תורת ארץ ישראל>סדר נזיקין","שערי תורת ארץ ישראל על תלמוד ירושלמי שבועות","זאב וואלף רבינוביץ","פירוש מהמאה ה-20 לתלמוד הירושלמי שנכתב על ידי הרב זאב וולף רבינוביץ","״שערי תורת ארץ ישראל״ הוא פירוש לתלמוד הירושלמי שנכתב בתחילת המאה ה-20 על ידי הרב זאב וולף רבינוביץ. המחבר כותב בהקדמתו כי למד את התלמוד הירושלמי מנעוריו ומצא כי הפירושים הקיימים אינם מספקים, בין השאר משום שמחבריהם הושפעו מגישות של התלמוד הבבלי הנלמד יותר. היצירה יצאה לאור לאחר מותו על ידי בנו של המחבר, יצחק רבינוביץ, שהקדיש אותה לזכר אמו.",""
"תלמוד ירושלמי>מפרשים>שערי תורת ארץ ישראל>סדר נזיקין","שערי תורת ארץ ישראל על תלמוד ירושלמי סנהדרין","זאב וואלף רבינוביץ","פירוש מהמאה ה-20 לתלמוד הירושלמי שנכתב על ידי הרב זאב וולף רבינוביץ","״שערי תורת ארץ ישראל״ הוא פירוש לתלמוד הירושלמי שנכתב בתחילת המאה ה-20 על ידי הרב זאב וולף רבינוביץ. המחבר כותב בהקדמתו כי למד את התלמוד הירושלמי מנעוריו ומצא כי הפירושים הקיימים אינם מספקים, בין השאר משום שמחבריהם הושפעו מגישות של התלמוד הבבלי הנלמד יותר. היצירה יצאה לאור לאחר מותו על ידי בנו של המחבר, יצחק רבינוביץ, שהקדיש אותה לזכר אמו.",""
"תלמוד ירושלמי>מפרשים>שערי תורת ארץ ישראל>סדר נזיקין","שערי תורת ארץ ישראל על תלמוד ירושלמי עבודה זרה","זאב וואלף רבינוביץ","פירוש מהמאה ה-20 לתלמוד הירושלמי שנכתב על ידי הרב זאב וולף רבינוביץ","״שערי תורת ארץ ישראל״ הוא פירוש לתלמוד הירושלמי שנכתב בתחילת המאה ה-20 על ידי הרב זאב וולף רבינוביץ. המחבר כותב בהקדמתו כי למד את התלמוד הירושלמי מנעוריו ומצא כי הפירושים הקיימים אינם מספקים, בין השאר משום שמחבריהם הושפעו מגישות של התלמוד הבבלי הנלמד יותר. היצירה יצאה לאור לאחר מותו על ידי בנו של המחבר, יצחק רבינוביץ, שהקדיש אותה לזכר אמו.",""
"תלמוד ירושלמי>מפרשים>שערי תורת ארץ ישראל>סדר נזיקין","שערי תורת ארץ ישראל על תלמוד ירושלמי בבא בתרא","זאב וואלף רבינוביץ","פירוש מהמאה ה-20 לתלמוד הירושלמי שנכתב על ידי הרב זאב וולף רבינוביץ","״שערי תורת ארץ ישראל״ הוא פירוש לתלמוד הירושלמי שנכתב בתחילת המאה ה-20 על ידי הרב זאב וולף רבינוביץ. המחבר כותב בהקדמתו כי למד את התלמוד הירושלמי מנעוריו ומצא כי הפירושים הקיימים אינם מספקים, בין השאר משום שמחבריהם הושפעו מגישות של התלמוד הבבלי הנלמד יותר. היצירה יצאה לאור לאחר מותו על ידי בנו של המחבר, יצחק רבינוביץ, שהקדיש אותה לזכר אמו.",""
"תלמוד ירושלמי>מפרשים>שערי תורת ארץ ישראל>סדר מועד","שערי תורת ארץ ישראל על תלמוד ירושלמי מגילה","זאב וואלף רבינוביץ","פירוש מהמאה ה-20 לתלמוד הירושלמי שנכתב על ידי הרב זאב וולף רבינוביץ","״שערי תורת ארץ ישראל״ הוא פירוש לתלמוד הירושלמי שנכתב בתחילת המאה ה-20 על ידי הרב זאב וולף רבינוביץ. המחבר כותב בהקדמתו כי למד את התלמוד הירושלמי מנעוריו ומצא כי הפירושים הקיימים אינם מספקים, בין השאר משום שמחבריהם הושפעו מגישות של התלמוד הבבלי הנלמד יותר. היצירה יצאה לאור לאחר מותו על ידי בנו של המחבר, יצחק רבינוביץ, שהקדיש אותה לזכר אמו.",""
"תלמוד ירושלמי>מפרשים>שערי תורת ארץ ישראל>סדר מועד","שערי תורת ארץ ישראל על תלמוד ירושלמי שקלים","זאב וואלף רבינוביץ","פירוש מהמאה ה-20 לתלמוד הירושלמי שנכתב על ידי הרב זאב וולף רבינוביץ","״שערי תורת ארץ ישראל״ הוא פירוש לתלמוד הירושלמי שנכתב בתחילת המאה ה-20 על ידי הרב זאב וולף רבינוביץ. המחבר כותב בהקדמתו כי למד את התלמוד הירושלמי מנעוריו ומצא כי הפירושים הקיימים אינם מספקים, בין השאר משום שמחבריהם הושפעו מגישות של התלמוד הבבלי הנלמד יותר. היצירה יצאה לאור לאחר מותו על ידי בנו של המחבר, יצחק רבינוביץ, שהקדיש אותה לזכר אמו.",""
"תלמוד ירושלמי>מפרשים>שערי תורת ארץ ישראל>סדר מועד","שערי תורת ארץ ישראל על תלמוד ירושלמי ביצה","זאב וואלף רבינוביץ","פירוש מהמאה ה-20 לתלמוד הירושלמי שנכתב על ידי הרב זאב וולף רבינוביץ","״שערי תורת ארץ ישראל״ הוא פירוש לתלמוד הירושלמי שנכתב בתחילת המאה ה-20 על ידי הרב זאב וולף רבינוביץ. המחבר כותב בהקדמתו כי למד את התלמוד הירושלמי מנעוריו ומצא כי הפירושים הקיימים אינם מספקים, בין השאר משום שמחבריהם הושפעו מגישות של התלמוד הבבלי הנלמד יותר. היצירה יצאה לאור לאחר מותו על ידי בנו של המחבר, יצחק רבינוביץ, שהקדיש אותה לזכר אמו.",""
"תלמוד ירושלמי>מפרשים>שערי תורת ארץ ישראל>סדר מועד","שערי תורת ארץ ישראל על תלמוד ירושלמי יומא","זאב וואלף רבינוביץ","פירוש מהמאה ה-20 לתלמוד הירושלמי שנכתב על ידי הרב זאב וולף רבינוביץ","״שערי תורת ארץ ישראל״ הוא פירוש לתלמוד הירושלמי שנכתב בתחילת המאה ה-20 על ידי הרב זאב וולף רבינוביץ. המחבר כותב בהקדמתו כי למד את התלמוד הירושלמי מנעוריו ומצא כי הפירושים הקיימים אינם מספקים, בין השאר משום שמחבריהם הושפעו מגישות של התלמוד הבבלי הנלמד יותר. היצירה יצאה לאור לאחר מותו על ידי בנו של המחבר, יצחק רבינוביץ, שהקדיש אותה לזכר אמו.",""
"תלמוד ירושלמי>מפרשים>שערי תורת ארץ ישראל>סדר מועד","שערי תורת ארץ ישראל על תלמוד ירושלמי ראש השנה","זאב וואלף רבינוביץ","פירוש מהמאה ה-20 לתלמוד הירושלמי שנכתב על ידי הרב זאב וולף רבינוביץ","״שערי תורת ארץ ישראל״ הוא פירוש לתלמוד הירושלמי שנכתב בתחילת המאה ה-20 על ידי הרב זאב וולף רבינוביץ. המחבר כותב בהקדמתו כי למד את התלמוד הירושלמי מנעוריו ומצא כי הפירושים הקיימים אינם מספקים, בין השאר משום שמחבריהם הושפעו מגישות של התלמוד הבבלי הנלמד יותר. היצירה יצאה לאור לאחר מותו על ידי בנו של המחבר, יצחק רבינוביץ, שהקדיש אותה לזכר אמו.",""
"תלמוד ירושלמי>מפרשים>שערי תורת ארץ ישראל>סדר מועד","שערי תורת ארץ ישראל על תלמוד ירושלמי שבת","זאב וואלף רבינוביץ","פירוש מהמאה ה-20 לתלמוד הירושלמי שנכתב על ידי הרב זאב וולף רבינוביץ","״שערי תורת ארץ ישראל״ הוא פירוש לתלמוד הירושלמי שנכתב בתחילת המאה ה-20 על ידי הרב זאב וולף רבינוביץ. המחבר כותב בהקדמתו כי למד את התלמוד הירושלמי מנעוריו ומצא כי הפירושים הקיימים אינם מספקים, בין השאר משום שמחבריהם הושפעו מגישות של התלמוד הבבלי הנלמד יותר. היצירה יצאה לאור לאחר מותו על ידי בנו של המחבר, יצחק רבינוביץ, שהקדיש אותה לזכר אמו.",""
"תלמוד ירושלמי>מפרשים>שערי תורת ארץ ישראל>סדר מועד","שערי תורת ארץ ישראל על תלמוד ירושלמי עירובין","זאב וואלף רבינוביץ","פירוש מהמאה ה-20 לתלמוד הירושלמי שנכתב על ידי הרב זאב וולף רבינוביץ","״שערי תורת ארץ ישראל״ הוא פירוש לתלמוד הירושלמי שנכתב בתחילת המאה ה-20 על ידי הרב זאב וולף רבינוביץ. המחבר כותב בהקדמתו כי למד את התלמוד הירושלמי מנעוריו ומצא כי הפירושים הקיימים אינם מספקים, בין השאר משום שמחבריהם הושפעו מגישות של התלמוד הבבלי הנלמד יותר. היצירה יצאה לאור לאחר מותו על ידי בנו של המחבר, יצחק רבינוביץ, שהקדיש אותה לזכר אמו.",""
